{
  "runId": "3f9c1a1b-6f4f-4bc2-8cf5-0bc70a2b5b11",
  "leaseEpoch": 3,
  "scopeId": "5b7a3c2b-e1d2-4f02-8a9d-4e3ec3c2a0a1",
  "scopeRevision": 9,
  "assignmentExpiresAt": "2026-09-12T14:30:00Z",
  "ranges": ["192.0.2.0/24"],
  "exclusions": ["192.0.2.9"],
  "entryPoints": [
    {
      "id": "ssh-default",
      "name": "SSH",
      "transport": "tcp",
      "port": 22,
      "accessMethod": "ssh"
    }
  ],
  "limits": {
    "probesPerSecond": 10,
    "concurrency": 16,
    "targetBudget": 256,
    "attemptBudget": 256,
    "timeoutMilliseconds": 2000,
    "runDeadlineSeconds": 600,
    "resultPageSize": 1000
  }
}
